{
  "$schema": "http://json-schema.org/draft-07/schema#",
  "title": "InstantiateMsg",
  "type": "object",
  "required": [
    "admin",
    "allow_member_add",
    "allow_member_exit",
    "caution_deposit",
    "contribution_amount",
    "cycle_duration",
    "deposit_deadline",
    "distribution_calendar",
    "distribution_mode",
    "early_withdrawal_penalty",
    "forbid_overpay",
    "forbid_underpay",
    "grace_seconds",
    "late_penalty_percent",
    "late_strike_limit",
    "max_members",
    "members",
    "name",
    "start_mode",
    "symbol",
    "total_cycles"
  ],
  "properties": {
    "admin": {
      "type": "string"
    },
    "allow_member_add": {
      "type": "boolean"
    },
    "allow_member_exit": {
      "type": "boolean"
    },
    "caution_deposit": {
      "$ref": "#/definitions/Uint128"
    },
    "contribution_amount": {
      "$ref": "#/definitions/Uint128"
    },
    "cycle_duration": {
      "type": "integer",
      "format": "uint64",
      "minimum": 0.0
    },
    "deposit_deadline": {
      "type": "integer",
      "format": "uint64",
      "minimum": 0.0
    },
    "distribution_calendar": {
      "type": "array",
      "items": {
        "type": "string"
      }
    },
    "distribution_mode": {
      "$ref": "#/definitions/DistributionMode"
    },
    "early_withdrawal_penalty": {
      "type": "integer",
      "format": "uint8",
      "minimum": 0.0
    },
    "forbid_overpay": {
      "type": "boolean"
    },
    "forbid_underpay": {
      "type": "boolean"
    },
    "grace_seconds": {
      "type": "integer",
      "format": "uint32",
      "minimum": 0.0
    },
    "late_penalty_percent": {
      "type": "integer",
      "format": "uint8",
      "minimum": 0.0
    },
    "late_strike_limit": {
      "type": "integer",
      "format": "uint8",
      "minimum": 0.0
    },
    "max_members": {
      "type": "integer",
      "format": "uint32",
      "minimum": 0.0
    },
    "member_profiles": {
      "type": [
        "object",
        "null"
      ],
      "additionalProperties": {
        "$ref": "#/definitions/MemberProfile"
      }
    },
    "members": {
      "type": "array",
      "items": {
        "type": "string"
      }
    },
    "name": {
      "type": "string"
    },
    "start_condition_auto": {
      "anyOf": [
        {
          "$ref": "#/definitions/StartConditionAuto"
        },
        {
          "type": "null"
        }
      ]
    },
    "start_mode": {
      "$ref": "#/definitions/StartMode"
    },
    "symbol": {
      "type": "string"
    },
    "total_cycles": {
      "type": "integer",
      "format": "uint32",
      "minimum": 0.0
    }
  },
  "definitions": {
    "DistributionMode": {
      "type": "string",
      "enum": [
        "Fifo",
        "Random",
        "Custom"
      ]
    },
    "MemberProfile": {
      "type": "object",
      "properties": {
        "pseudo": {
          "type": [
            "string",
            "null"
          ]
        }
      }
    },
    "StartConditionAuto": {
      "oneOf": [
        {
          "type": "object",
          "required": [
            "MembersReached"
          ],
          "properties": {
            "MembersReached": {
              "type": "integer",
              "format": "uint32",
              "minimum": 0.0
            }
          },
          "additionalProperties": false
        },
        {
          "type": "object",
          "required": [
            "StartDate"
          ],
          "properties": {
            "StartDate": {
              "$ref": "#/definitions/Timestamp"
            }
          },
          "additionalProperties": false
        }
      ]
    },
    "StartMode": {
      "type": "string",
      "enum": [
        "Manual",
        "Auto"
      ]
    },
    "Timestamp": {
      "description": "A point in time in nanosecond precision.\n\nThis type can represent times from 1970-01-01T00:00:00Z to 2554-07-21T23:34:33Z.\n\n## Examples\n\n``` # use cosmwasm_std::Timestamp; let ts = Timestamp::from_nanos(1_000_000_202); assert_eq!(ts.nanos(), 1_000_000_202); assert_eq!(ts.seconds(), 1); assert_eq!(ts.subsec_nanos(), 202);\n\nlet ts = ts.plus_seconds(2); assert_eq!(ts.nanos(), 3_000_000_202); assert_eq!(ts.seconds(), 3); assert_eq!(ts.subsec_nanos(), 202); ```",
      "allOf": [
        {
          "$ref": "#/definitions/Uint64"
        }
      ]
    },
    "Uint128": {
      "description": "A thin wrapper around u128 that is using strings for JSON encoding/decoding, such that the full u128 range can be used for clients that convert JSON numbers to floats, like JavaScript and jq.\n\n# Examples\n\nUse `from` to create instances of this and `u128` to get the value out:\n\n``` # use cosmwasm_std::Uint128; let a = Uint128::from(123u128); assert_eq!(a.u128(), 123);\n\nlet b = Uint128::from(42u64); assert_eq!(b.u128(), 42);\n\nlet c = Uint128::from(70u32); assert_eq!(c.u128(), 70); ```",
      "type": "string"
    },
    "Uint64": {
      "description": "A thin wrapper around u64 that is using strings for JSON encoding/decoding, such that the full u64 range can be used for clients that convert JSON numbers to floats, like JavaScript and jq.\n\n# Examples\n\nUse `from` to create instances of this and `u64` to get the value out:\n\n``` # use cosmwasm_std::Uint64; let a = Uint64::from(42u64); assert_eq!(a.u64(), 42);\n\nlet b = Uint64::from(70u32); assert_eq!(b.u64(), 70); ```",
      "type": "string"
    }
  }
}
