{
  "name": "Community Tontine Group",
  "symbol": "CTG",
  "admin": "safro1abc123...",
  "members": [
    "safro1member1...",
    "safro1member2...",
    "safro1member3...",
    "safro1member4...",
    "safro1member5..."
  ],
  "member_profiles": null,
  "contribution_amount": "1000000",
  "total_cycles": 5,
  "cycle_duration": 2592000,
  "distribution_mode": "Fifo",
  "start_mode": "Manual",
  "start_condition_auto": null,
  "deposit_deadline": 86400,
  "grace_seconds": 3600,
  "late_penalty_percent": 10,
  "late_strike_limit": 3,
  "distribution_calendar": [
    "safro1member1...",
    "safro1member2...",
    "safro1member3...",
    "safro1member4...",
    "safro1member5..."
  ],
  "allow_member_exit": true,
  "allow_member_add": false,
  "early_withdrawal_penalty": 5,
  "forbid_overpay": true,
  "forbid_underpay": true,
  "max_members": 10,
  "caution_deposit": "500000"
}